{
  "shortScript": "If you’re trying to break into enterprise marketing, here’s an overlooked path most people are sleeping on: email development. Not just newsletters. I’m talking HTML emails, QA, personalization, automation, AI workflows, campaign briefs, and the systems enterprise teams use to communicate with millions of customers. I’m building a process that takes a campaign brief, runs it through an AI agent, maps it into custom HTML templates, creates QA notes, journey logic, deployment notes, and packages the whole thing into a ZIP. That is proof-of-work. And proof-of-work is how you become harder to ignore. I’m still working in corporate, and I’m building this in public because this lane is bigger than people think. Learn AI. Build proof. Grow your value. Subscribe if you want to become the AI-powered email developer companies cannot ignore.",
  "longScript": "Some people are trying to break into tech. Some people are trying to leave jobs that are wearing them down. Some people just graduated college and still cannot get through the front door of a major company. Some people are already in marketing, but they feel stuck, underpaid, or invisible. This video is for all of you, because there is an overlooked path into enterprise marketing and technical career growth that not enough people are talking about: email development.\n\nAnd I do not mean just sending newsletters. I mean enterprise email development. HTML email. QA. Dark mode. Personalization. Marketing automation. Campaign briefs. Customer journeys. Analytics. Compliance reviews. AI workflows. The real production systems that help companies communicate with thousands or millions of customers.\n\nI’m Nat O’Farril. I’m an enterprise email developer, campaign analyst, and AI workflow builder. I’ve spent years around real corporate marketing production: campaign deadlines, testing, approvals, personalization, broken briefs, last-minute changes, and all the details people do not see from the outside. And what I know is this: email development is not small. Email is enterprise infrastructure.\n\nHere is why this path matters. Almost every serious company needs email. Banks need email. Retail brands need email. Healthcare companies need email. Universities need email. SaaS companies need email. Agencies need email. And behind every major email program, someone has to build, test, personalize, automate, and ship the campaign.\n\nThat creates an opportunity. You do not need to become a full-stack software engineer overnight to become valuable. You can start with HTML email. Then learn QA. Then learn personalization. Then learn marketing automation. Then learn AI tools like ChatGPT, GitHub Copilot, Cursor, and agents. Over time, you stop being the person who only builds an email and you become the person who understands the workflow.\n\nThat is where AI changes everything. AI does not replace your judgment. It expands what you can produce when you already understand the work. For example, I’m building a Brief-to-ZIP workflow. The idea is simple: start with a campaign brief, run it through an AI agent, generate the subject lines, preheader, email copy, plain text version, custom HTML template, QA checklist, UTM map, journey logic, deployment notes, approval summary, and package everything into a ZIP.\n\nThat is proof-of-work. And proof-of-work is one of the fastest ways to stand out. If you are trying to get hired, promoted, freelance, consult, or simply become more valuable where you already are, you need more than motivation. You need evidence. You need something you can show.\n\nThis channel is about building that evidence in public. I’m still working in corporate. I have responsibilities. I know what it feels like to be tired and still know you are capable of more. So this is not me standing at the finish line acting like everything is easy. This is me building the road while walking it.\n\nOn this channel, we are going to cover AI-powered email development, HTML email, QA, personalization, AMPscript thinking, enterprise marketing workflows, GitHub Copilot, ChatGPT, AI agents, proof-of-work portfolios, salary positioning, and real demo builds. We are going to build the Brief-to-ZIP system. We are going to create reusable templates. We are going to turn learning into content, content into proof, and proof into leverage.\n\nIf you are blue collar and looking for a practical way into enterprise work, start here. If you just graduated and cannot get a shot, start here. If you are in marketing but want to become more technical, start here. If you are already an email developer but want to become harder to replace, start here.\n\nThe framework is simple: Learn AI. Build proof. Grow your value.\n\nSubscribe if you want to become the AI-powered email developer companies cannot ignore. In the next video, I’m going to show the first version of the Brief-to-ZIP workflow and how a simple campaign brief becomes a real production package.",
  "thumbnail": {
    "headline": "OVERLOOKED → ENTERPRISE",
    "subhead": "AI EMAIL DEV ROADMAP",
    "cta": "Build Proof"
  },
  "captions": [
    {"timeStart": "0:00", "timeEnd": "0:03", "text": "Trying to break into enterprise marketing?"},
    {"timeStart": "0:03", "timeEnd": "0:07", "text": "Here’s the overlooked path: email development."},
    {"timeStart": "0:07", "timeEnd": "0:11", "text": "Not just newsletters. Enterprise email."},
    {"timeStart": "0:11", "timeEnd": "0:17", "text": "HTML. QA. Personalization. Automation. AI workflows."},
    {"timeStart": "0:17", "timeEnd": "0:23", "text": "I’m building a system that turns a campaign brief into a full production package."},
    {"timeStart": "0:23", "timeEnd": "0:29", "text": "Brief → AI Agent → Custom HTML → QA → ZIP"},
    {"timeStart": "0:29", "timeEnd": "0:36", "text": "That is proof-of-work. And proof gets you noticed."},
    {"timeStart": "0:36", "timeEnd": "0:44", "text": "I’m still working in corporate, and I’m building this in public."},
    {"timeStart": "0:44", "timeEnd": "0:51", "text": "Because this lane is bigger than people think."},
    {"timeStart": "0:51", "timeEnd": "0:56", "text": "Learn AI. Build proof. Grow your value."},
    {"timeStart": "0:56", "timeEnd": "1:00", "text": "Subscribe to become the AI-powered email developer companies cannot ignore."}
  ],
  "videoPlan": [
    {"clip": "broll/job_board_scroll.mp4", "duration": 3, "overlayText": "Trying to break into enterprise marketing?", "motion": "slow zoom in", "transition": "quick cut"},
    {"clip": "broll/campaign_brief_scroll.mp4", "duration": 4, "overlayText": "Start with email development", "motion": "screen push-in", "transition": "swipe left"},
    {"clip": "broll/html_email_code.mp4", "duration": 4, "overlayText": "HTML Email", "motion": "cursor highlight", "transition": "glitch cut"},
    {"clip": "broll/email_preview_desktop_mobile.mp4", "duration": 4, "overlayText": "QA + Rendering", "motion": "split-screen zoom", "transition": "flash cut"},
    {"clip": "broll/chatgpt_agent_prompt.mp4", "duration": 5, "overlayText": "Brief → AI Agent", "motion": "typing highlight", "transition": "quick cut"},
    {"clip": "broll/template_generator_output.mp4", "duration": 5, "overlayText": "Custom HTML Template", "motion": "zoom to generated email", "transition": "slide up"},
    {"clip": "broll/qa_checklist_scroll.mp4", "duration": 4, "overlayText": "QA Checklist", "motion": "checkmark animation", "transition": "quick cut"},
    {"clip": "broll/zip_package_folder.mp4", "duration": 5, "overlayText": "Full ZIP Package", "motion": "folder open zoom", "transition": "impact cut"},
    {"clip": "broll/corporate_desk_setup.mp4", "duration": 5, "overlayText": "Building in public", "motion": "slow cinematic push", "transition": "fade"},
    {"clip": "broll/avatar_ai_email_dev_loop.mp4", "duration": 6, "overlayText": "Learn AI. Build proof. Grow your value.", "motion": "avatar lower-right with animated background", "transition": "fade to end card"},
    {"clip": "broll/subscribe_end_card.mp4", "duration": 5, "overlayText": "Become the AI-powered email developer companies cannot ignore", "motion": "subscribe button pulse", "transition": "end"}
  ],
  "musicSuggestion": {
    "mood": "energetic corporate tech with subtle cinematic urgency",
    "volume": "voiceover at 100%, music bed at 12% to 18%, duck music under voice",
    "styleNotes": "Use clean synth pulse, no distracting vocals, no copyrighted commercial songs."
  },
  "metadata": {
    "title": "The Overlooked Path Into Enterprise Marketing: AI Email Development",
    "description": "Email development is one of the most overlooked paths into enterprise marketing, agency work, CRM teams, and AI-powered career growth. In this video, I’m showing how I’m building a Brief-to-ZIP AI email workflow that turns a campaign brief into a real production package: custom HTML email, QA checklist, journey logic, deployment notes, and more.\n\nThis channel is for blue-collar career changers, recent grads, overlooked marketers, campaign analysts, email developers, and corporate builders who want a practical path into enterprise marketing and AI-powered development.\n\nLearn AI. Build proof. Grow your value.\n\nChapters:\n0:00 The overlooked path\n0:30 Why email development matters\n1:10 Enterprise email is bigger than newsletters\n2:00 Brief-to-ZIP workflow\n3:00 Proof-of-work portfolio\n4:00 Building in public\n4:45 Final CTA\n\nSubscribe if you want to become the AI-powered email developer companies cannot ignore.",
    "tags": ["AI Email Developer", "Email Development", "Enterprise Marketing", "Marketing Automation", "HTML Email", "ChatGPT", "GitHub Copilot", "Career Change", "Proof of Work", "AI Workflow", "Email Marketing", "Marketing Cloud", "AMPscript", "Corporate Career Growth", "Faceless YouTube"],